{
  "wojewodztwo": "opolskie",
  "wojewodztwo_label": "Opolskie",
  "tier": "2",
  "data_aktualizacji": "2026-04-27",
  "zrodlo_danych": "skeleton z POWIATY_SORT v3",
  "powiaty": [
    {
      "voivodeship": "opolskie",
      "name": "Opole",
      "display_name": "MUP Opole",
      "display_meta": "Opole",
      "url_pup": "https://opole.praca.gov.pl",
      "urgency": "nieznany",
      "urgency_days": 0,
      "kfs_start_date": null,
      "kfs_end_date": null,
      "kfs_status": "DO_WERYFIKACJI",
      "efs_status": "DO_WERYFIKACJI",
      "amount_kfs": 0,
      "amount_total": 0,
      "irin_match": 0,
      "has_warning": true,
      "pillars": [],
      "pillar_details": [],
      "claudia_note": null
    },
    {
      "voivodeship": "opolskie",
      "name": "Opole - powiat",
      "display_name": "PUP Opole",
      "display_meta": "Opole - powiat",
      "url_pup": "https://opole.praca.gov.pl",
      "urgency": "nieznany",
      "urgency_days": 0,
      "kfs_start_date": null,
      "kfs_end_date": null,
      "kfs_status": "DO_WERYFIKACJI",
      "efs_status": "DO_WERYFIKACJI",
      "amount_kfs": 0,
      "amount_total": 0,
      "irin_match": 0,
      "has_warning": true,
      "pillars": [],
      "pillar_details": [],
      "claudia_note": null
    },
    {
      "voivodeship": "opolskie",
      "name": "Brzeg",
      "display_name": "PUP Brzeg",
      "display_meta": "powiat Brzeg",
      "url_pup": "https://brzeg.praca.gov.pl",
      "urgency": "nieznany",
      "urgency_days": 0,
      "kfs_start_date": null,
      "kfs_end_date": null,
      "kfs_status": "DO_WERYFIKACJI",
      "efs_status": "DO_WERYFIKACJI",
      "amount_kfs": 0,
      "amount_total": 0,
      "irin_match": 0,
      "has_warning": true,
      "pillars": [],
      "pillar_details": [],
      "claudia_note": null
    },
    {
      "voivodeship": "opolskie",
      "name": "Głubczyce",
      "display_name": "PUP Głubczyce",
      "display_meta": "powiat Głubczyce",
      "url_pup": "https://glubczyce.praca.gov.pl",
      "urgency": "nieznany",
      "urgency_days": 0,
      "kfs_start_date": null,
      "kfs_end_date": null,
      "kfs_status": "DO_WERYFIKACJI",
      "efs_status": "DO_WERYFIKACJI",
      "amount_kfs": 0,
      "amount_total": 0,
      "irin_match": 0,
      "has_warning": true,
      "pillars": [],
      "pillar_details": [],
      "claudia_note": null
    },
    {
      "voivodeship": "opolskie",
      "name": "Kędzierzyn-Koźle",
      "display_name": "PUP Kędzierzyn-Koźle",
      "display_meta": "powiat Kędzierzyn-Koźle",
      "url_pup": "https://kedzierzyn-kozle.praca.gov.pl",
      "urgency": "nieznany",
      "urgency_days": 0,
      "kfs_start_date": null,
      "kfs_end_date": null,
      "kfs_status": "DO_WERYFIKACJI",
      "efs_status": "DO_WERYFIKACJI",
      "amount_kfs": 0,
      "amount_total": 0,
      "irin_match": 0,
      "has_warning": true,
      "pillars": [],
      "pillar_details": [],
      "claudia_note": null
    },
    {
      "voivodeship": "opolskie",
      "name": "Kluczbork",
      "display_name": "PUP Kluczbork",
      "display_meta": "powiat Kluczbork",
      "url_pup": "https://kluczbork.praca.gov.pl",
      "urgency": "nieznany",
      "urgency_days": 0,
      "kfs_start_date": null,
      "kfs_end_date": null,
      "kfs_status": "DO_WERYFIKACJI",
      "efs_status": "DO_WERYFIKACJI",
      "amount_kfs": 0,
      "amount_total": 0,
      "irin_match": 0,
      "has_warning": true,
      "pillars": [],
      "pillar_details": [],
      "claudia_note": null
    },
    {
      "voivodeship": "opolskie",
      "name": "Krapkowice",
      "display_name": "PUP Krapkowice",
      "display_meta": "powiat Krapkowice",
      "url_pup": "https://krapkowice.praca.gov.pl",
      "urgency": "nieznany",
      "urgency_days": 0,
      "kfs_start_date": null,
      "kfs_end_date": null,
      "kfs_status": "DO_WERYFIKACJI",
      "efs_status": "DO_WERYFIKACJI",
      "amount_kfs": 0,
      "amount_total": 0,
      "irin_match": 0,
      "has_warning": true,
      "pillars": [],
      "pillar_details": [],
      "claudia_note": null
    },
    {
      "voivodeship": "opolskie",
      "name": "Namysłów",
      "display_name": "PUP Namysłów",
      "display_meta": "powiat Namysłów",
      "url_pup": "https://namyslow.praca.gov.pl",
      "urgency": "nieznany",
      "urgency_days": 0,
      "kfs_start_date": null,
      "kfs_end_date": null,
      "kfs_status": "DO_WERYFIKACJI",
      "efs_status": "DO_WERYFIKACJI",
      "amount_kfs": 0,
      "amount_total": 0,
      "irin_match": 0,
      "has_warning": true,
      "pillars": [],
      "pillar_details": [],
      "claudia_note": null
    },
    {
      "voivodeship": "opolskie",
      "name": "Nysa",
      "display_name": "PUP Nysa",
      "display_meta": "powiat Nysa",
      "url_pup": "https://nysa.praca.gov.pl",
      "urgency": "nieznany",
      "urgency_days": 0,
      "kfs_start_date": null,
      "kfs_end_date": null,
      "kfs_status": "DO_WERYFIKACJI",
      "efs_status": "DO_WERYFIKACJI",
      "amount_kfs": 0,
      "amount_total": 0,
      "irin_match": 0,
      "has_warning": true,
      "pillars": [],
      "pillar_details": [],
      "claudia_note": null
    },
    {
      "voivodeship": "opolskie",
      "name": "Olesno",
      "display_name": "PUP Olesno",
      "display_meta": "powiat Olesno",
      "url_pup": "https://olesno.praca.gov.pl",
      "urgency": "nieznany",
      "urgency_days": 0,
      "kfs_start_date": null,
      "kfs_end_date": null,
      "kfs_status": "DO_WERYFIKACJI",
      "efs_status": "DO_WERYFIKACJI",
      "amount_kfs": 0,
      "amount_total": 0,
      "irin_match": 0,
      "has_warning": true,
      "pillars": [],
      "pillar_details": [],
      "claudia_note": null
    },
    {
      "voivodeship": "opolskie",
      "name": "Prudnik",
      "display_name": "PUP Prudnik",
      "display_meta": "powiat Prudnik",
      "url_pup": "https://prudnik.praca.gov.pl",
      "urgency": "nieznany",
      "urgency_days": 0,
      "kfs_start_date": null,
      "kfs_end_date": null,
      "kfs_status": "DO_WERYFIKACJI",
      "efs_status": "DO_WERYFIKACJI",
      "amount_kfs": 0,
      "amount_total": 0,
      "irin_match": 0,
      "has_warning": true,
      "pillars": [],
      "pillar_details": [],
      "claudia_note": null
    },
    {
      "voivodeship": "opolskie",
      "name": "Strzelce Opolskie",
      "display_name": "PUP Strzelce Opolskie",
      "display_meta": "powiat Strzelce Opolskie",
      "url_pup": "https://strzelceopolskie.praca.gov.pl",
      "urgency": "nieznany",
      "urgency_days": 0,
      "kfs_start_date": null,
      "kfs_end_date": null,
      "kfs_status": "DO_WERYFIKACJI",
      "efs_status": "DO_WERYFIKACJI",
      "amount_kfs": 0,
      "amount_total": 0,
      "irin_match": 0,
      "has_warning": true,
      "pillars": [],
      "pillar_details": [],
      "claudia_note": null
    }
  ]
}