{
  "wojewodztwo": "lubuskie",
  "wojewodztwo_label": "Lubuskie",
  "tier": "2",
  "data_aktualizacji": "2026-04-27",
  "zrodlo_danych": "skeleton z POWIATY_SORT v3",
  "powiaty": [
    {
      "voivodeship": "lubuskie",
      "name": "Zielona Góra",
      "display_name": "MUP Zielona Góra",
      "display_meta": "Zielona Góra",
      "url_pup": "https://zielonagora.praca.gov.pl",
      "urgency": "nieznany",
      "urgency_days": 0,
      "kfs_start_date": null,
      "kfs_end_date": null,
      "kfs_status": "DO_WERYFIKACJI",
      "efs_status": "DO_WERYFIKACJI",
      "amount_kfs": 0,
      "amount_total": 0,
      "irin_match": 0,
      "has_warning": true,
      "pillars": [],
      "pillar_details": [],
      "claudia_note": null,
      "akcja_status": "zadzwon",
      "akcja_status_uzasadnienie": "Brak danych - zadzwon do PUP"
    },
    {
      "voivodeship": "lubuskie",
      "name": "Gorzów Wielkopolski",
      "display_name": "MUP Gorzów Wielkopolski",
      "display_meta": "Gorzów Wielkopolski",
      "url_pup": "https://gorzowwielkopolski.praca.gov.pl",
      "urgency": "nieznany",
      "urgency_days": 0,
      "kfs_start_date": null,
      "kfs_end_date": null,
      "kfs_status": "DO_WERYFIKACJI",
      "efs_status": "DO_WERYFIKACJI",
      "amount_kfs": 0,
      "amount_total": 0,
      "irin_match": 0,
      "has_warning": true,
      "pillars": [],
      "pillar_details": [],
      "claudia_note": null,
      "akcja_status": "zadzwon",
      "akcja_status_uzasadnienie": "Brak danych - zadzwon do PUP"
    },
    {
      "voivodeship": "lubuskie",
      "name": "Zielona Góra - powiat",
      "display_name": "PUP Zielona Góra",
      "display_meta": "Zielona Góra - powiat",
      "url_pup": "https://zielonagora.praca.gov.pl",
      "urgency": "nieznany",
      "urgency_days": 0,
      "kfs_start_date": null,
      "kfs_end_date": null,
      "kfs_status": "DO_WERYFIKACJI",
      "efs_status": "DO_WERYFIKACJI",
      "amount_kfs": 0,
      "amount_total": 0,
      "irin_match": 0,
      "has_warning": true,
      "pillars": [],
      "pillar_details": [],
      "claudia_note": null,
      "akcja_status": "zadzwon",
      "akcja_status_uzasadnienie": "Brak danych - zadzwon do PUP"
    },
    {
      "voivodeship": "lubuskie",
      "name": "Gorzów Wielkopolski - powiat",
      "display_name": "PUP Gorzów Wielkopolski",
      "display_meta": "Gorzów Wielkopolski - powiat",
      "url_pup": "https://gorzowwielkopolski.praca.gov.pl",
      "urgency": "nieznany",
      "urgency_days": 0,
      "kfs_start_date": null,
      "kfs_end_date": null,
      "kfs_status": "DO_WERYFIKACJI",
      "efs_status": "DO_WERYFIKACJI",
      "amount_kfs": 0,
      "amount_total": 0,
      "irin_match": 0,
      "has_warning": true,
      "pillars": [],
      "pillar_details": [],
      "claudia_note": null,
      "akcja_status": "zadzwon",
      "akcja_status_uzasadnienie": "Brak danych - zadzwon do PUP"
    },
    {
      "voivodeship": "lubuskie",
      "name": "Krosno Odrzańskie",
      "display_name": "PUP Krosno Odrzańskie",
      "display_meta": "powiat Krosno Odrzańskie",
      "url_pup": "https://krosnoodrzanskie.praca.gov.pl",
      "urgency": "nieznany",
      "urgency_days": 0,
      "kfs_start_date": null,
      "kfs_end_date": null,
      "kfs_status": "DO_WERYFIKACJI",
      "efs_status": "DO_WERYFIKACJI",
      "amount_kfs": 0,
      "amount_total": 0,
      "irin_match": 0,
      "has_warning": true,
      "pillars": [],
      "pillar_details": [],
      "claudia_note": null,
      "akcja_status": "zadzwon",
      "akcja_status_uzasadnienie": "Brak danych - zadzwon do PUP"
    },
    {
      "voivodeship": "lubuskie",
      "name": "Międzyrzecz",
      "display_name": "PUP Międzyrzecz",
      "display_meta": "powiat Międzyrzecz",
      "url_pup": "https://miedzyrzecz.praca.gov.pl",
      "urgency": "nieznany",
      "urgency_days": 0,
      "kfs_start_date": null,
      "kfs_end_date": null,
      "kfs_status": "DO_WERYFIKACJI",
      "efs_status": "DO_WERYFIKACJI",
      "amount_kfs": 0,
      "amount_total": 0,
      "irin_match": 0,
      "has_warning": true,
      "pillars": [],
      "pillar_details": [],
      "claudia_note": null,
      "akcja_status": "zadzwon",
      "akcja_status_uzasadnienie": "Brak danych - zadzwon do PUP"
    },
    {
      "voivodeship": "lubuskie",
      "name": "Nowa Sól",
      "display_name": "PUP Nowa Sól",
      "display_meta": "powiat Nowa Sól",
      "url_pup": "https://nowasol.praca.gov.pl",
      "urgency": "nieznany",
      "urgency_days": 0,
      "kfs_start_date": null,
      "kfs_end_date": null,
      "kfs_status": "DO_WERYFIKACJI",
      "efs_status": "DO_WERYFIKACJI",
      "amount_kfs": 0,
      "amount_total": 0,
      "irin_match": 0,
      "has_warning": true,
      "pillars": [],
      "pillar_details": [],
      "claudia_note": null,
      "akcja_status": "zadzwon",
      "akcja_status_uzasadnienie": "Brak danych - zadzwon do PUP"
    },
    {
      "voivodeship": "lubuskie",
      "name": "Słubice",
      "display_name": "PUP Słubice",
      "display_meta": "powiat Słubice",
      "url_pup": "https://slubice.praca.gov.pl",
      "urgency": "nieznany",
      "urgency_days": 0,
      "kfs_start_date": null,
      "kfs_end_date": null,
      "kfs_status": "DO_WERYFIKACJI",
      "efs_status": "DO_WERYFIKACJI",
      "amount_kfs": 0,
      "amount_total": 0,
      "irin_match": 0,
      "has_warning": true,
      "pillars": [],
      "pillar_details": [],
      "claudia_note": null,
      "akcja_status": "zadzwon",
      "akcja_status_uzasadnienie": "Brak danych - zadzwon do PUP"
    },
    {
      "voivodeship": "lubuskie",
      "name": "Strzelce Krajeńskie",
      "display_name": "PUP Strzelce Krajeńskie",
      "display_meta": "powiat Strzelce Krajeńskie",
      "url_pup": "https://strzelcekrajenskie.praca.gov.pl",
      "urgency": "nieznany",
      "urgency_days": 0,
      "kfs_start_date": null,
      "kfs_end_date": null,
      "kfs_status": "DO_WERYFIKACJI",
      "efs_status": "DO_WERYFIKACJI",
      "amount_kfs": 0,
      "amount_total": 0,
      "irin_match": 0,
      "has_warning": true,
      "pillars": [],
      "pillar_details": [],
      "claudia_note": null,
      "akcja_status": "zadzwon",
      "akcja_status_uzasadnienie": "Brak danych - zadzwon do PUP"
    },
    {
      "voivodeship": "lubuskie",
      "name": "Sulęcin",
      "display_name": "PUP Sulęcin",
      "display_meta": "powiat Sulęcin",
      "url_pup": "https://sulecin.praca.gov.pl",
      "urgency": "nieznany",
      "urgency_days": 0,
      "kfs_start_date": null,
      "kfs_end_date": null,
      "kfs_status": "DO_WERYFIKACJI",
      "efs_status": "DO_WERYFIKACJI",
      "amount_kfs": 0,
      "amount_total": 0,
      "irin_match": 0,
      "has_warning": true,
      "pillars": [],
      "pillar_details": [],
      "claudia_note": null,
      "akcja_status": "zadzwon",
      "akcja_status_uzasadnienie": "Brak danych - zadzwon do PUP"
    },
    {
      "voivodeship": "lubuskie",
      "name": "Świebodzin",
      "display_name": "PUP Świebodzin",
      "display_meta": "powiat Świebodzin",
      "url_pup": "https://swiebodzin.praca.gov.pl",
      "urgency": "nieznany",
      "urgency_days": 0,
      "kfs_start_date": null,
      "kfs_end_date": null,
      "kfs_status": "DO_WERYFIKACJI",
      "efs_status": "DO_WERYFIKACJI",
      "amount_kfs": 0,
      "amount_total": 0,
      "irin_match": 0,
      "has_warning": true,
      "pillars": [],
      "pillar_details": [],
      "claudia_note": null,
      "akcja_status": "zadzwon",
      "akcja_status_uzasadnienie": "Brak danych - zadzwon do PUP"
    },
    {
      "voivodeship": "lubuskie",
      "name": "Wschowa",
      "display_name": "PUP Wschowa",
      "display_meta": "powiat Wschowa",
      "url_pup": "https://wschowa.praca.gov.pl",
      "urgency": "nieznany",
      "urgency_days": 0,
      "kfs_start_date": null,
      "kfs_end_date": null,
      "kfs_status": "DO_WERYFIKACJI",
      "efs_status": "DO_WERYFIKACJI",
      "amount_kfs": 0,
      "amount_total": 0,
      "irin_match": 0,
      "has_warning": true,
      "pillars": [],
      "pillar_details": [],
      "claudia_note": null,
      "akcja_status": "zadzwon",
      "akcja_status_uzasadnienie": "Brak danych - zadzwon do PUP"
    },
    {
      "voivodeship": "lubuskie",
      "name": "Żagań",
      "display_name": "PUP Żagań",
      "display_meta": "powiat Żagań",
      "url_pup": "https://zagan.praca.gov.pl",
      "urgency": "nieznany",
      "urgency_days": 0,
      "kfs_start_date": null,
      "kfs_end_date": null,
      "kfs_status": "DO_WERYFIKACJI",
      "efs_status": "DO_WERYFIKACJI",
      "amount_kfs": 0,
      "amount_total": 0,
      "irin_match": 0,
      "has_warning": true,
      "pillars": [],
      "pillar_details": [],
      "claudia_note": null,
      "akcja_status": "zadzwon",
      "akcja_status_uzasadnienie": "Brak danych - zadzwon do PUP"
    },
    {
      "voivodeship": "lubuskie",
      "name": "Żary",
      "display_name": "PUP Żary",
      "display_meta": "powiat Żary",
      "url_pup": "https://zary.praca.gov.pl",
      "urgency": "nieznany",
      "urgency_days": 0,
      "kfs_start_date": null,
      "kfs_end_date": null,
      "kfs_status": "DO_WERYFIKACJI",
      "efs_status": "DO_WERYFIKACJI",
      "amount_kfs": 0,
      "amount_total": 0,
      "irin_match": 0,
      "has_warning": true,
      "pillars": [],
      "pillar_details": [],
      "claudia_note": null,
      "akcja_status": "zadzwon",
      "akcja_status_uzasadnienie": "Brak danych - zadzwon do PUP"
    }
  ]
}
